title,year,cast,url
Back in Action,2025,"Jamie Foxx, Cameron Diaz",https://www.imdb.com/title/tt21191806/?ref_=fn_ttl_ttl_1
Last Action Hero,1993,"Arnold Schwarzenegger, F. Murray Abraham",https://www.imdb.com/title/tt0107362/?ref_=fn_ttl_ttl_2
Action Jackson,1988,"Carl Weathers, Craig T. Nelson",https://www.imdb.com/title/tt0094612/?ref_=fn_ttl_ttl_3
Action Point,2018,"Johnny Knoxville, Eleanor Worthington-Cox",https://www.imdb.com/title/tt6495770/?ref_=fn_ttl_ttl_4
Action,1980,"Luc Merenda, Adriana Asti",https://www.imdb.com/title/tt0078732/?ref_=fn_ttl_ttl_5
Action! Action!,2025,"Mark Justice, Adam Kilbourn",https://www.imdb.com/title/tt15263752/?ref_=fn_ttl_ttl_6
Action Replayy,2010,"Akshay Kumar, Aishwarya Rai Bachchan",https://www.imdb.com/title/tt1396208/?ref_=fn_ttl_ttl_7
A Civil Action,1998,"John Travolta, Robert Duvall",https://www.imdb.com/title/tt0120633/?ref_=fn_ttl_ttl_8
Action,2019,"Vishal, Tamannaah Bhatia",https://www.imdb.com/title/tt10955578/?ref_=fn_ttl_ttl_9
Missing in Action,1984,"Chuck Norris, M. Emmet Walsh",https://www.imdb.com/title/tt0087727/?ref_=fn_ttl_ttl_10
Looney Tunes: Back in Action,2003,"Brendan Fraser, Jenna Elfman",https://www.imdb.com/title/tt0318155/?ref_=fn_ttl_ttl_11
An Action Hero,2022,"Ayushmann Khurrana, Jaideep Ahlawat",https://www.imdb.com/title/tt15600222/?ref_=fn_ttl_ttl_12
Action in the North Atlantic,1943,"Humphrey Bogart, Raymond Massey",https://www.imdb.com/title/tt0035608/?ref_=fn_ttl_ttl_13
Class Action Park,2020,"John Hodgman, Faith Anderson",https://www.imdb.com/title/tt11015214/?ref_=fn_ttl_ttl_14
Class Action,1991,"Gene Hackman, Mary Elizabeth Mastrantonio",https://www.imdb.com/title/tt0101590/?ref_=fn_ttl_ttl_15
Action Force,"Joe Anoa'i, Pierson Fode",N/A,https://www.imdb.com/title/tt15237908/?ref_=fn_ttl_ttl_16
A Man of Action,2022,"Juan José Ballesta, Luis Callejo",https://www.imdb.com/title/tt12703292/?ref_=fn_ttl_ttl_17
Action Hero Biju,2016,"Nivin Pauly, Anu Emmanuel",https://www.imdb.com/title/tt5320514/?ref_=fn_ttl_ttl_18
Action Jackson,2014,"Ajay Devgn, Shahid Kapoor",https://www.imdb.com/title/tt0403935/?ref_=fn_ttl_ttl_19
Mutant Action,1993,"Antonio Resines, Álex Angulo",https://www.imdb.com/title/tt0106215/?ref_=fn_ttl_ttl_20
Missing in Action 2: The Beginning,1985,"Chuck Norris, Soon-Tek Oh",https://www.imdb.com/title/tt0089604/?ref_=fn_ttl_ttl_21
Gundam I: The Live-Action Movie,"Leon Masuda, Alexander Raye Pimentel",N/A,https://www.imdb.com/title/tt8678318/?ref_=fn_ttl_ttl_22
Executive Action,1973,"Burt Lancaster, Robert Ryan",https://www.imdb.com/title/tt0070046/?ref_=fn_ttl_ttl_23
Action U.S.A.,1989,"Gregory Scott Cummins, William Hubbard Knight",https://www.imdb.com/title/tt0096757/?ref_=fn_ttl_ttl_24
Mufasa: The Lion King,2024,"Aaron Pierre, Kelvin Harrison Jr.",https://www.imdb.com/title/tt13186482/?ref_=fn_ttl_ttl_25
Back in Action,1994,"Billy Blanks, Roddy Piper",https://www.imdb.com/title/tt0109195/?ref_=fn_ttl_ttl_26
A Piece of the Action,1977,"Sidney Poitier, Bill Cosby",https://www.imdb.com/title/tt0076543/?ref_=fn_ttl_ttl_27
Untitled Hong Kong Action Thriller,N/A,N/A,https://www.imdb.com/title/tt5195538/?ref_=fn_ttl_ttl_28
Action #1,"Mike Castle, Jimmy Tatro",N/A,https://www.imdb.com/title/tt2298239/?ref_=fn_ttl_ttl_29
Legal Action,2018,"Eric Close, Nick Searcy",https://www.imdb.com/title/tt7656570/?ref_=fn_ttl_ttl_30
Braddock: Missing in Action III,1988,"Chuck Norris, Aki Aleong",https://www.imdb.com/title/tt0094792/?ref_=fn_ttl_ttl_31
Anchorman: The Legend of Ron Burgundy,2004,"Will Ferrell, Christina Applegate",https://www.imdb.com/title/tt0357413/?ref_=fn_ttl_ttl_32
Silent Action,1975,"Luc Merenda, Mel Ferrer",https://www.imdb.com/title/tt0075083/?ref_=fn_ttl_ttl_33
Action of the Tiger,1957,"Van Johnson, Martine Carol",https://www.imdb.com/title/tt0050099/?ref_=fn_ttl_ttl_34
Gintama Live Action the Movie,2017,"Yûya Yagira, Kôichi Yamadera",https://www.imdb.com/title/tt5805470/?ref_=fn_ttl_ttl_35
Thanksgiving,2023,"Patrick Dempsey, Ty Olsson",https://www.imdb.com/title/tt1448754/?ref_=fn_ttl_ttl_36
1946 Direct Action Day,2024,"Abhishek Singh Ias, Raima Sen",https://www.imdb.com/title/tt31598972/?ref_=fn_ttl_ttl_37
Direct Action,2004,"Dolph Lundgren, Polly Shannon",https://www.imdb.com/title/tt0368688/?ref_=fn_ttl_ttl_38
Action,2013,"Allari Naresh, Shaam",https://www.imdb.com/title/tt2370244/?ref_=fn_ttl_ttl_39
Love and Action in Chicago,1999,"Courtney B. Vance, Regina King",https://www.imdb.com/title/tt0176948/?ref_=fn_ttl_ttl_40
Truth or Dare,2018,"Lucy Hale, Tyler Posey",https://www.imdb.com/title/tt6772950/?ref_=fn_ttl_ttl_41
The Violence Action,2022,"Kanna Hashimoto, Yôsuke Sugino",https://www.imdb.com/title/tt17677492/?ref_=fn_ttl_ttl_42
Action Man,1967,"Jean Gabin, Robert Stack",https://www.imdb.com/title/tt0061000/?ref_=fn_ttl_ttl_43
Evasive Action,1998,"Dorian Harewood, Ray Wise",https://www.imdb.com/title/tt0167145/?ref_=fn_ttl_ttl_44
Untitled Zach Snyder LAPD Action Movie,N/A,N/A,https://www.imdb.com/title/tt34621929/?ref_=fn_ttl_ttl_45
The Contractor,2022,"Chris Pine, Gillian Jacobs",https://www.imdb.com/title/tt10323676/?ref_=fn_ttl_ttl_46
Confessions of an Action Star,2005,"Holmes Osborne, David Leitch",https://www.imdb.com/title/tt0337887/?ref_=fn_ttl_ttl_47
The Action Pack,2023,"Matei Dima, Vlad Brumaru",https://www.imdb.com/title/tt26673530/?ref_=fn_ttl_ttl_48
321 Action,2020,"Rakan Abdulwahed, Dyler",https://www.imdb.com/title/tt13423846/?ref_=fn_ttl_ttl_49
Love Action Drama,2019,"Nivin Pauly, Nayanthara",https://www.imdb.com/title/tt7117870/?ref_=fn_ttl_ttl_50
Action in Arabia,1944,"George Sanders, Virginia Bruce",https://www.imdb.com/title/tt0036579/?ref_=fn_ttl_ttl_51
Action!,2023,"Jaden Blatt, Jacob John Buterbaugh",https://www.imdb.com/title/tt28751601/?ref_=fn_ttl_ttl_52
In Search of the Last Action Heroes,2019,"Scott Adkins, Stuart Ashen",https://www.imdb.com/title/tt8840400/?ref_=fn_ttl_ttl_53
Kureyon Shinchan: Action Kamen vs Haigure Maô,1993,"Akiko Yajima, Miki Narahashi",https://www.imdb.com/title/tt0409848/?ref_=fn_ttl_ttl_54
Action Hero Biju 2,"Joju George, Nivin Pauly",N/A,https://www.imdb.com/title/tt27487348/?ref_=fn_ttl_ttl_55
Action 8,"Yolanthe Cabau, Amara Wayans",N/A,https://www.imdb.com/title/tt28305739/?ref_=fn_ttl_ttl_56
Toy Story 2: Live Action,2025,"Jude Forsey, Alex Murphy",https://www.imdb.com/title/tt10782784/?ref_=fn_ttl_ttl_57
Untitled action film,"Kamal Haasan, Salman Khan",N/A,https://www.imdb.com/title/tt33319882/?ref_=fn_ttl_ttl_58
Operation Dames,1959,"Eve Meyer, Chuck Henderson",https://www.imdb.com/title/tt0053142/?ref_=fn_ttl_ttl_59
Action: The October Crisis of 1970,1974,"Thor Bishopric, Pierre Bourgault",https://www.imdb.com/title/tt0069677/?ref_=fn_ttl_ttl_60
Stand by for Action,1942,"Robert Taylor, Brian Donlevy",https://www.imdb.com/title/tt0036386/?ref_=fn_ttl_ttl_61
Action immédiate,1957,"Henri Vidal, Barbara Laage",https://www.imdb.com/title/tt0048925/?ref_=fn_ttl_ttl_62
Who's Got the Action?,1962,"Dean Martin, Lana Turner",https://www.imdb.com/title/tt0056691/?ref_=fn_ttl_ttl_63
Action team overlord flower,2022,"Zina Blahusova, Wei Chen",https://www.imdb.com/title/tt20417836/?ref_=fn_ttl_ttl_64
Ryan: First Mission,"Kartik Aaryan, Fardeen Khan",N/A,https://www.imdb.com/title/tt6526078/?ref_=fn_ttl_ttl_65
The Great American Action Hero,"Lee Majors, Jake Busey",N/A,https://www.imdb.com/title/tt14377236/?ref_=fn_ttl_ttl_66
"Dykes, Camera, Action!",2018,"Desiree Akhavan, Janet Baus",https://www.imdb.com/title/tt7917688/?ref_=fn_ttl_ttl_67
2025 Oscar Nominated Short Films: Live Action,2025,N/A,https://www.imdb.com/title/tt35115983/?ref_=fn_ttl_ttl_68
Strip for Action,1974,"Marianne Dupont, Michel Jacot",https://www.imdb.com/title/tt0071884/?ref_=fn_ttl_ttl_69
Fireman Sam: Set for Action!,2018,"John Barrowman, Steven Kynman",https://www.imdb.com/title/tt9081188/?ref_=fn_ttl_ttl_70
Bakugan Live Action,N/A,N/A,https://www.imdb.com/title/tt35673289/?ref_=fn_ttl_ttl_71
Action Is Not Missing,1987,"Dolphy, Ricky Brown",https://www.imdb.com/title/tt0266224/?ref_=fn_ttl_ttl_72
Untitled Dwayne Johnson Action Comedy,N/A,N/A,https://www.imdb.com/title/tt5260532/?ref_=fn_ttl_ttl_73
Direct Action,2024,N/A,https://www.imdb.com/title/tt31015444/?ref_=fn_ttl_ttl_74
Action for Slander,1937,"Clive Brook, Ann Todd",https://www.imdb.com/title/tt0029838/?ref_=fn_ttl_ttl_75
The Flintstones,1994,"John Goodman, Rick Moranis",https://www.imdb.com/title/tt0109813/?ref_=fn_ttl_ttl_76
Movie in Action,1987,"Bo Svenson, Robert Marius",https://www.imdb.com/title/tt0378389/?ref_=fn_ttl_ttl_77
Truth or Die,2012,"Tom Kane, Liam Boyle",https://www.imdb.com/title/tt1838722/?ref_=fn_ttl_ttl_78
Spooky Action,2023,"Arthur Aulisi, Jordan Allen Bell",https://www.imdb.com/title/tt12982582/?ref_=fn_ttl_ttl_79
Enemy Action,1999,"C. Thomas Howell, Louis Mandylor",https://www.imdb.com/title/tt0175593/?ref_=fn_ttl_ttl_80
Armed for Action,1992,"Joe Estevez, Rocky Patterson",https://www.imdb.com/title/tt0103719/?ref_=fn_ttl_ttl_81
'Untitled Female Led Action/Thriller',"Graham McTavish, Peter Mensah",N/A,https://www.imdb.com/title/tt3158386/?ref_=fn_ttl_ttl_82
Action Boys,2008,"Jong-cheol Jeong, Sei-Jin Jeun",https://www.imdb.com/title/tt1441233/?ref_=fn_ttl_ttl_83
A Special Cop in Action,1976,"Maurizio Merli, Raymond Pellegrin",https://www.imdb.com/title/tt0179901/?ref_=fn_ttl_ttl_84
Untitled Live-Action Barney movie Project,N/A,N/A,https://www.imdb.com/title/tt35926717/?ref_=fn_ttl_ttl_85
Action,1921,"Hoot Gibson, Francis Ford",https://www.imdb.com/title/tt0011906/?ref_=fn_ttl_ttl_86
The Action,1960,"Lojze Rozman, Aleksander Valic",https://www.imdb.com/title/tt0180406/?ref_=fn_ttl_ttl_87
Rapid Action,2023,"Binglei Li, Ulrica Tang",https://www.imdb.com/title/tt24133834/?ref_=fn_ttl_ttl_88
Single Action,1998,"Carlos Gallardo, Alejandra Prado",https://www.imdb.com/title/tt0176145/?ref_=fn_ttl_ttl_89
Executive Decision,1996,"Kurt Russell, Halle Berry",https://www.imdb.com/title/tt0116253/?ref_=fn_ttl_ttl_90
The Accidental Detective 2: In Action,2018,"Kwon Sang-woo, Sung Dong-il",https://www.imdb.com/title/tt7022500/?ref_=fn_ttl_ttl_91
Action Movie Kid,N/A,N/A,https://www.imdb.com/title/tt5363994/?ref_=fn_ttl_ttl_92
Cruella: Live Action Novelization,2021,Elizabeth Knowelden,https://www.imdb.com/title/tt28331320/?ref_=fn_ttl_ttl_93
Covert Action,1978,"David Janssen, Corinne Cléry",https://www.imdb.com/title/tt0077376/?ref_=fn_ttl_ttl_94
And Action,2017,"Anthony Jeanne, Cherine El-Hajj",https://www.imdb.com/title/tt6092354/?ref_=fn_ttl_ttl_95
20 Minutes of Action,2020,"Margot Avery, Lily Balsen",https://www.imdb.com/title/tt6098564/?ref_=fn_ttl_ttl_96
North Country,2005,"Charlize Theron, Jeremy Renner",https://www.imdb.com/title/tt0395972/?ref_=fn_ttl_ttl_97
RAM: Rapid Action Mission,2024,"Surya Ayyalasomyajula, Dhanya Balakrishna",https://www.imdb.com/title/tt30850798/?ref_=fn_ttl_ttl_98
Spooky Action at a Distance,N/A,N/A,https://www.imdb.com/title/tt37021583/?ref_=fn_ttl_ttl_99
In Action,2020,"Sean Kenealy, Eric Silvera",https://www.imdb.com/title/tt12327512/?ref_=fn_ttl_ttl_100
